link,tags,likes,comments,path
https://cdn.pixabay.com/photo/2022/03/06/05/30/clouds-7050884__480.jpg,"Blue Sky, Clouds, Atmosphere, Sky",196,55,Imgs/clouds-7050884__480.jpg
https://cdn.pixabay.com/photo/2022/04/07/11/45/bird-7117346__340.jpg,"Ornithology, Hummingbird Bird,",76,20,Imgs/bird-7117346__340.jpg
https://cdn.pixabay.com/photo/2022/02/28/15/28/sea-7039471__340.jpg,"Sea, Subtropical Rainbow, Rainfall,",282,106,Imgs/sea-7039471__340.jpg
https://cdn.pixabay.com/photo/2022/04/04/02/52/cherry-blossoms-7110279__340.jpg,"Sakura Japan, Road, Cherry Blossoms,",42,11,Imgs/cherry-blossoms-7110279__340.jpg
https://cdn.pixabay.com/photo/2022/04/09/18/06/cape-marguerite-7121992__340.jpg,"Plant Marguerite, Cape Flower,",39,15,Imgs/cape-marguerite-7121992__340.jpg
https://cdn.pixabay.com/photo/2021/11/13/23/06/tree-6792528__340.jpg,Relaxing Under Tree The Rest,522,108,Imgs/tree-6792528__340.jpg
https://cdn.pixabay.com/photo/2022/04/07/02/56/cottontail-rabbit-7116707__340.jpg,"Cottontail Grass Wild Rabbit,",51,10,Imgs/cottontail-rabbit-7116707__340.jpg
https://cdn.pixabay.com/photo/2022/03/19/21/11/crocus-7079550__340.jpg,"Flowers, Crocus, Plant Spring,",135,44,Imgs/crocus-7079550__340.jpg
https://cdn.pixabay.com/photo/2022/04/09/17/30/coffee-7121939__340.jpg,"Table Vacation, Coffee, Drink, Café,",26,5,Imgs/coffee-7121939__340.jpg
https://cdn.pixabay.com/photo/2022/03/25/19/24/waterfall-7091641__340.jpg,"Fall, Waterfall, Epic, Nature, Light",96,21,Imgs/waterfall-7091641__340.jpg
https://cdn.pixabay.com/photo/2021/08/25/20/42/field-6574455__340.jpg,"Nature Field, Morning, Sunrise, Dawn,",807,131,Imgs/field-6574455__340.jpg
https://cdn.pixabay.com/photo/2022/04/04/18/03/bird-7111988__340.jpg,"Animal Birdwatching, Robin, Bird,",69,19,Imgs/bird-7111988__340.jpg
https://cdn.pixabay.com/photo/2022/04/04/07/58/seedlings-7110591__340.jpg,"Soil, Seedlings, Spring Bloom Flowers,",42,9,Imgs/seedlings-7110591__340.jpg
https://cdn.pixabay.com/photo/2022/03/23/21/27/road-7087957__340.jpg,"Hills Highway, Countryside, Road,",53,14,Imgs/road-7087957__340.jpg
https://cdn.pixabay.com/photo/2022/03/27/15/03/cityscape-7095358__340.jpg,"Bridge, Cityscape, Monochrome, City",45,13,Imgs/cityscape-7095358__340.jpg
https://cdn.pixabay.com/photo/2022/03/25/17/54/sakura-7091532__340.jpg,"Sakura, Water Cherry Blossoms, Spring,",70,12,Imgs/sakura-7091532__340.jpg
https://cdn.pixabay.com/photo/2022/04/01/19/03/background-7105471__480.jpg,"Eggs, Art Template, Background, Easter,",5,2,Imgs/background-7105471__480.jpg
https://cdn.pixabay.com/photo/2022/01/31/12/46/bird-6983434__340.jpg,"Species Ornithology, Chat, Indian Bird,",171,53,Imgs/bird-6983434__340.jpg
https://cdn.pixabay.com/photo/2022/01/18/16/49/town-6947538__340.jpg,"Town, Night, Winter, Season Village,",109,15,Imgs/town-6947538__340.jpg
https://cdn.pixabay.com/photo/2022/04/09/17/42/flower-7121955__340.jpg,"Pansy, Viola, Flower, Bloom Blossom,",55,36,Imgs/flower-7121955__340.jpg
https://cdn.pixabay.com/photo/2021/08/30/21/29/port-6587129__340.jpg,"Vacations Architecture, Lake, Port,",276,49,Imgs/port-6587129__340.jpg
https://cdn.pixabay.com/photo/2022/03/16/02/03/sunflowers-7071449__340.jpg,"Flowers, Sunflowers, Plant",54,21,Imgs/sunflowers-7071449__340.jpg
https://cdn.pixabay.com/photo/2022/03/28/18/41/coffee-7098126__340.jpg,"Flowers, Coffee, Spring, Morning",40,10,Imgs/coffee-7098126__340.jpg
https://cdn.pixabay.com/photo/2022/02/12/06/21/roys-peak-7008528__340.jpg,"Peak, Lake, Wanaka, Roys Mountains",69,19,Imgs/roys-peak-7008528__340.jpg
https://cdn.pixabay.com/photo/2021/11/21/21/14/mountain-6815304__340.jpg,"you many likes. everyone. for downloads and Thank you,",197,0,Imgs/mountain-6815304__340.jpg
https://cdn.pixabay.com/photo/2021/08/22/15/48/nature-6565499__340.jpg,"Outdoors, Nature, Beach, Exploration",272,150,Imgs/nature-6565499__340.jpg
https://cdn.pixabay.com/photo/2022/03/03/11/18/nature-7045125__340.jpg,Shot of sunset. Danish during Coast Jutland. The West,48,11,Imgs/nature-7045125__340.jpg
https://cdn.pixabay.com/photo/2022/03/16/21/01/gentoo-penguin-7073391__340.jpg,"Animal Gentoo Bird, Penguin,",93,22,Imgs/gentoo-penguin-7073391__340.jpg
https://cdn.pixabay.com/photo/2021/11/26/20/45/lantern-6826698__340.jpg,"Lantern, Beach, Sea, Water, Heaven, Tree",243,31,Imgs/lantern-6826698__340.jpg
https://cdn.pixabay.com/photo/2022/04/03/05/03/easter-7108066__340.jpg,"Bunny Easter Spring, Easter,",17,10,Imgs/easter-7108066__340.jpg
https://cdn.pixabay.com/photo/2018/01/14/23/12/nature-3082832__340.jpg,rock on green formation lake during trees daytime brown,3098,495,Imgs/nature-3082832__340.jpg
https://cdn.pixabay.com/photo/2022/02/27/19/46/tourist-attraction-7037967__340.jpg,"Travel Eiffel Tower, Tourist Attraction,",83,21,Imgs/tourist-attraction-7037967__340.jpg
https://cdn.pixabay.com/photo/2022/04/07/22/23/menhir-7118382__480.jpg,"Menhir, Clouds, Standing Stones, Stones",64,49,Imgs/menhir-7118382__480.jpg
https://cdn.pixabay.com/photo/2022/01/13/18/05/road-6935773__340.jpg,"Winter, Frost, Snow, Road, Path Trees,",133,24,Imgs/road-6935773__340.jpg
https://cdn.pixabay.com/photo/2022/04/10/07/03/bird-7122753__340.jpg,"Bird, Woodpecker",28,20,Imgs/bird-7122753__340.jpg
https://cdn.pixabay.com/photo/2021/11/25/19/50/tape-6824489__340.jpg,"Tape, Classic Cassette, Retro, Music,",134,20,Imgs/tape-6824489__340.jpg
https://cdn.pixabay.com/photo/2022/01/10/15/29/wind-mills-6928590__340.jpg,"Wind Clouds, Power Energy, Mills,",144,101,Imgs/wind-mills-6928590__340.jpg
https://cdn.pixabay.com/photo/2022/02/15/07/27/travel-7014427__340.jpg,"Piran Tourism, Square, Travel, Tartini,",70,19,Imgs/travel-7014427__340.jpg
https://cdn.pixabay.com/photo/2022/04/11/04/33/easter-eggs-7124718__340.jpg,"Eggs, Nest, Eggs Easter Colored",29,0,Imgs/easter-eggs-7124718__340.jpg
https://cdn.pixabay.com/photo/2022/02/07/22/27/winter-7000429__340.jpg,"Travel Outdoors, Winter, Nature, Season,",111,24,Imgs/winter-7000429__340.jpg
https://cdn.pixabay.com/photo/2022/04/11/09/40/glacier-7125386__340.jpg,"Dying Glacier, Melting Glaciers, Glacier",36,27,Imgs/glacier-7125386__340.jpg
https://cdn.pixabay.com/photo/2021/11/01/21/31/forest-6761846__340.jpg,"Forest, Jungle, Nature Green, Tropical,",135,22,Imgs/forest-6761846__340.jpg
https://cdn.pixabay.com/photo/2022/02/05/08/13/tulip-6994245__340.jpg,"Petals Tulip, Flower, Blossom, Bloom,",92,35,Imgs/tulip-6994245__340.jpg
https://cdn.pixabay.com/photo/2022/04/07/13/06/flowers-7117461__340.jpg,"Flowers, Pink Petals",62,0,Imgs/flowers-7117461__340.jpg
https://cdn.pixabay.com/photo/2022/02/22/03/22/passiflora-7027917__340.jpg,"Passiflora, Flower, Flower Passion",97,66,Imgs/passiflora-7027917__340.jpg
https://cdn.pixabay.com/photo/2021/11/02/21/57/prayer-6764197__340.jpg,"Faith, Blessing Religion, Hope, Prayer,",175,57,Imgs/prayer-6764197__340.jpg
https://cdn.pixabay.com/photo/2022/04/09/10/13/galaxy-7121195__340.jpg,"Space, Cosmos Galaxy, Universe, Star,",45,40,Imgs/galaxy-7121195__340.jpg
https://cdn.pixabay.com/photo/2022/03/31/09/25/dragonfly-7102558__480.jpg,"Macro Nature, Dragonfly, Insect,",19,3,Imgs/dragonfly-7102558__480.jpg
